image_path,caption
F:\DataS\data v\HP_ALL\HP1\philosophers01.jpg,Owl sitting on pivet drive sign board
F:\DataS\data v\HP_ALL\HP1\philosophers02.jpg,Professor Dumbledore under street light
F:\DataS\data v\HP_ALL\HP1\philosophers03.jpg,Professor Dumbledore and Professor Mcgonagall at door with baby
F:\DataS\data v\HP_ALL\HP1\philosophers04.jpg,Baby with lightning shaped scar
F:\DataS\data v\HP_ALL\HP1\philosophers05.jpg,Harry peeking though trapdoor
F:\DataS\data v\HP_ALL\HP1\philosophers06.jpg,Harry playing with toys
F:\DataS\data v\HP_ALL\HP1\philosophers07.jpg,Petunia and Vernon Dursley
F:\DataS\data v\HP_ALL\HP1\philosophers08.jpg,Parliament of owls in pivet drive
F:\DataS\data v\HP_ALL\HP1\philosophers09.jpg,Letters falling everywhere in Harry's house
F:\DataS\data v\HP_ALL\HP1\philosophers10.jpg,Hagrid and Harry in hut
F:\DataS\data v\HP_ALL\HP1\philosophers11.jpg,Hagrid in crowded diagon alley
F:\DataS\data v\HP_ALL\HP1\philosophers12.jpg,Shocked Harry beside ticket machine
F:\DataS\data v\HP_ALL\HP1\philosophers13.jpg,Harry entering wands shop
F:\DataS\data v\HP_ALL\HP1\philosophers14.jpg,Harry happy he found his wand
F:\DataS\data v\HP_ALL\HP1\philosophers15.jpg,Dark night at Muggle world house
F:\DataS\data v\HP_ALL\HP1\philosophers16.jpg,Hogwarts express going though mountains
F:\DataS\data v\HP_ALL\HP1\philosophers17.jpg,Harry and Ron talking
F:\DataS\data v\HP_ALL\HP1\philosophers18.jpg,Dumbledore wizard card
F:\DataS\data v\HP_ALL\HP1\philosophers19.jpg,Hogwarts Castle in moonlit night
F:\DataS\data v\HP_ALL\HP1\philosophers20.jpg,Hermione and other hogwarts students riding boat in great lake
F:\DataS\data v\HP_ALL\HP1\philosophers21.jpg,Shocked professor Mcgonagall
F:\DataS\data v\HP_ALL\HP1\philosophers22.jpg,Great hall full of candles and Hogwarts students
F:\DataS\data v\HP_ALL\HP1\philosophers23.jpg,Nearly Headless Nick frustrated
F:\DataS\data v\HP_ALL\HP1\philosophers24.jpg,Hogwarts students in Griffindor common room at night
F:\DataS\data v\HP_ALL\HP1\philosophers25.jpg,Harry sitting in window at night
F:\DataS\data v\HP_ALL\HP1\philosophers26.jpg,Professor Snape teaching students in Potions classroom
F:\DataS\data v\HP_ALL\HP1\philosophers27.jpg,Professor Snape asking students to open books
F:\DataS\data v\HP_ALL\HP1\philosophers28.jpg,Students learning to fly on brooms
F:\DataS\data v\HP_ALL\HP1\philosophers29.jpg,Draco Malfoy with Neville's Remembrall
F:\DataS\data v\HP_ALL\HP1\philosophers30.jpg,"Harry, Ron and Hermione in Dark corridor"
F:\DataS\data v\HP_ALL\HP1\philosophers31.jpg,Argus Filch in dark corridor
F:\DataS\data v\HP_ALL\HP1\philosophers32.jpg,Harry and Ron on stairs in night
F:\DataS\data v\HP_ALL\HP1\philosophers33.jpg,Harry and Ron spying together
F:\DataS\data v\HP_ALL\HP1\philosophers34.jpg,Hogwart student fell unconsious on Quiddich pitch
F:\DataS\data v\HP_ALL\HP1\philosophers35.jpg,Slytherin Student shocked
F:\DataS\data v\HP_ALL\HP1\philosophers36.jpg,Harry won quiddich game by catching golden snitch
F:\DataS\data v\HP_ALL\HP1\philosophers37.jpg,Harry in Invisibility cloak at night
F:\DataS\data v\HP_ALL\HP1\philosophers38.jpg,Suspicious argus filch in night
F:\DataS\data v\HP_ALL\HP1\philosophers39.jpg,Professor Snape and Professor Quirrell talking
F:\DataS\data v\HP_ALL\HP1\philosophers40.jpg,Argus Filch is caretaker of castle
F:\DataS\data v\HP_ALL\HP1\philosophers41.jpg,Harry in front of Mirror of Erisel
F:\DataS\data v\HP_ALL\HP1\philosophers42.jpg,Harry with his parents james and lily in mirror
F:\DataS\data v\HP_ALL\HP1\philosophers43.jpg,Harry and owl hedwig in snow filled garden
F:\DataS\data v\HP_ALL\HP1\philosophers44.jpg,Hogwarts castle and Quiddich Hoops in bright day
F:\DataS\data v\HP_ALL\HP1\philosophers45.jpg,Draco Malfoy smirking in night
F:\DataS\data v\HP_ALL\HP1\philosophers46.jpg,"Harry, Ron, Hermione and Draco scolded by Professor Mcgonagall in Dark night"
F:\DataS\data v\HP_ALL\HP1\philosophers47.jpg,Hagrid in forbbiden forest at night
F:\DataS\data v\HP_ALL\HP1\philosophers48.jpg,2 people and 1 animal in forbbiden forest at night
F:\DataS\data v\HP_ALL\HP1\philosophers49.jpg,Someon in black cloak in forest clearing
F:\DataS\data v\HP_ALL\HP1\philosophers50.jpg,Hagrid's hut in daylight
F:\DataS\data v\HP_ALL\HP1\philosophers51.jpg,Professor Mcgonagall working in classroom
F:\DataS\data v\HP_ALL\HP1\philosophers52.jpg,"Harry, Ron and Hermione in Dark room with 3 headed big dog"
F:\DataS\data v\HP_ALL\HP1\philosophers53.jpg,"Harry, Ron and Hermione entangled in Devil Snare plant in dark"
F:\DataS\data v\HP_ALL\HP1\philosophers54.jpg,Harry with flying broomstick
F:\DataS\data v\HP_ALL\HP1\philosophers55.jpg,Ron standing on Big chessboard to play
F:\DataS\data v\HP_ALL\HP1\philosophers56.jpg,"Harry, Ron and Hermione stopped by stone statues on chessboard"
F:\DataS\data v\HP_ALL\HP1\philosophers57.jpg,Ron sitting on stone horse statue
F:\DataS\data v\HP_ALL\HP1\philosophers58.jpg,Hermione looking around worried
F:\DataS\data v\HP_ALL\HP1\philosophers59.jpg,Harry and Professor Quirrell looking in mirror of erisel
F:\DataS\data v\HP_ALL\HP1\philosophers60.jpg,Bald Lord Voldermort in Quirrell's head
F:\DataS\data v\HP_ALL\HP1\philosophers61.jpg,Harry injured and scared
F:\DataS\data v\HP_ALL\HP1\philosophers62.jpg,Harry's parents and lord voldermort in mirror of erisel
F:\DataS\data v\HP_ALL\HP1\philosophers63.jpg,Harry's Family picture
F:\DataS\data v\HP_ALL\HP1\philosophers64.jpg,Harry waving from hogwarts express
F:\DataS\data v\HP_ALL\HP1\philosophers65.jpg,Hogwarts express leaving from hogwart's station
F:\DataS\data v\HP_ALL\HP2\chamberofsecrets01.jpg,Sunset in evening clouds
F:\DataS\data v\HP_ALL\HP2\chamberofsecrets02.jpg,Harry studying in his room
F:\DataS\data v\HP_ALL\HP2\chamberofsecrets03.jpg,Harry's eyes reflecting in his glasses
F:\DataS\data v\HP_ALL\HP2\chamberofsecrets04.jpg,Cake flying in dursley's house
F:\DataS\data v\HP_ALL\HP2\chamberofsecrets05.jpg,Shocked harry by flashing green light
F:\DataS\data v\HP_ALL\HP2\chamberofsecrets06.jpg,Professor lockhart smiling in bookstore
F:\DataS\data v\HP_ALL\HP2\chamberofsecrets07.jpg,Car flying over mountains
F:\DataS\data v\HP_ALL\HP2\chamberofsecrets08.jpg,Hogwarts whoomping wilow tree at night
F:\DataS\data v\HP_ALL\HP2\chamberofsecrets09.jpg,Angry Professor Mcgonagall standing in dungeons
F:\DataS\data v\HP_ALL\HP2\chamberofsecrets10.jpg,Hogwarts students students having breakfast in great hall
F:\DataS\data v\HP_ALL\HP2\chamberofsecrets11.jpg,Professor lockhart smiling at his own potrait in classroom
F:\DataS\data v\HP_ALL\HP2\chamberofsecrets12.jpg,Pixie demon creatures causing havoc in classroom
F:\DataS\data v\HP_ALL\HP2\chamberofsecrets13.jpg,Hogwarts castle and it's great lake
F:\DataS\data v\HP_ALL\HP2\chamberofsecrets14.jpg,Hermione crying silently
F:\DataS\data v\HP_ALL\HP2\chamberofsecrets15.jpg,Professor lockhart's classroom
F:\DataS\data v\HP_ALL\HP2\chamberofsecrets16.jpg,Professor snape looking for something
F:\DataS\data v\HP_ALL\HP2\chamberofsecrets17.jpg,Argus Filch very disappointed 
F:\DataS\data v\HP_ALL\HP2\chamberofsecrets18.jpg,Hermione is confused at night
F:\DataS\data v\HP_ALL\HP2\chamberofsecrets19.jpg,Professor Mcgonagall is worried about something
F:\DataS\data v\HP_ALL\HP2\chamberofsecrets20.jpg,Quiddich field's spectator seats and castle in th background
F:\DataS\data v\HP_ALL\HP2\chamberofsecrets21.jpg,Harry playing Quiddich sports
F:\DataS\data v\HP_ALL\HP2\chamberofsecrets22.jpg,Harry in hospital wings talking to dobby the house elf at night
F:\DataS\data v\HP_ALL\HP2\chamberofsecrets23.jpg,"Harry, Ron and Hermione making potion in girl's washroom inside potion pot"
F:\DataS\data v\HP_ALL\HP2\chamberofsecrets24.jpg,Ron being watched by ghost of Moaning myrtle
F:\DataS\data v\HP_ALL\HP2\chamberofsecrets25.jpg,Professor lockhart walking on ramp in dueling club
F:\DataS\data v\HP_ALL\HP2\chamberofsecrets26.jpg,Harry learning to fight with wand like wizards
F:\DataS\data v\HP_ALL\HP2\chamberofsecrets27.jpg,Snape looking scared in front of hogwarts students
F:\DataS\data v\HP_ALL\HP2\chamberofsecrets28.jpg,Argus Filch angry about his cats death
F:\DataS\data v\HP_ALL\HP2\chamberofsecrets29.jpg,Harry standing in dark corridor at night looking confused
F:\DataS\data v\HP_ALL\HP2\chamberofsecrets30.jpg,Harry looking at professor Dumbledore from bottom of stairs in his office
F:\DataS\data v\HP_ALL\HP2\chamberofsecrets31.jpg,Hagrid looking confused at night
F:\DataS\data v\HP_ALL\HP2\chamberofsecrets32.jpg,Herd of horses pulling sledge in slow
F:\DataS\data v\HP_ALL\HP2\chamberofsecrets33.jpg,Great hall decorated with christmas decoration
F:\DataS\data v\HP_ALL\HP2\chamberofsecrets34.jpg,Harry shocked looking in the mirror
F:\DataS\data v\HP_ALL\HP2\chamberofsecrets35.jpg,Hermione looking like a furry cat
F:\DataS\data v\HP_ALL\HP2\chamberofsecrets36.jpg,Hogwarts castle view from outside in night with lake and mountains in background
F:\DataS\data v\HP_ALL\HP2\chamberofsecrets37.jpg,long Corridor filled with leaking water
F:\DataS\data v\HP_ALL\HP2\chamberofsecrets38.jpg,Ghost of moaning myrtle sitting on window ceil
F:\DataS\data v\HP_ALL\HP2\chamberofsecrets39.jpg,"""Let me take you back fifty years ago"" written on a diary page"
F:\DataS\data v\HP_ALL\HP2\chamberofsecrets40.jpg,Dairy glowing in harry's hands
F:\DataS\data v\HP_ALL\HP2\chamberofsecrets41.jpg,Hagrid and Tom talking in flashback
F:\DataS\data v\HP_ALL\HP2\chamberofsecrets42.jpg,Harry pulled by glowing light
F:\DataS\data v\HP_ALL\HP2\chamberofsecrets43.jpg,Hagrid weilding crossbow due to fear
F:\DataS\data v\HP_ALL\HP2\chamberofsecrets44.jpg,"Harry, Ron and Dog walking in forbbiden forest in night"
F:\DataS\data v\HP_ALL\HP2\chamberofsecrets45.jpg,Harry and Ron talking with giant spider in forbbiden forest
F:\DataS\data v\HP_ALL\HP2\chamberofsecrets46.jpg,Harry looking relived about something
F:\DataS\data v\HP_ALL\HP2\chamberofsecrets47.jpg,Harry and Ron sorrounded by spiders in forbbiden forest
F:\DataS\data v\HP_ALL\HP2\chamberofsecrets48.jpg,Sun shining through hogwarts castle gaps
F:\DataS\data v\HP_ALL\HP2\chamberofsecrets49.jpg,"""Her skeleton will lie in the chamber forever"" written with blood on wall"
F:\DataS\data v\HP_ALL\HP2\chamberofsecrets50.jpg,Harry and Ron raising their wands for fighting
F:\DataS\data v\HP_ALL\HP2\chamberofsecrets51.jpg,Ghost of moaning myrtle happily smiling
F:\DataS\data v\HP_ALL\HP2\chamberofsecrets52.jpg,Harry is very traumatized by something
F:\DataS\data v\HP_ALL\HP2\chamberofsecrets53.jpg,Professor lockhart looking scared in dark chamber
F:\DataS\data v\HP_ALL\HP2\chamberofsecrets54.jpg,Harry looking determined to do something in dark chamber
F:\DataS\data v\HP_ALL\HP2\chamberofsecrets55.jpg,Harry walking towards statue in dark chamber of secrets
F:\DataS\data v\HP_ALL\HP2\chamberofsecrets56.jpg,Tom Riddle telling he is the lord vodermort
F:\DataS\data v\HP_ALL\HP2\chamberofsecrets57.jpg,Harry injured and scared after seeing lord voldermort
F:\DataS\data v\HP_ALL\HP2\chamberofsecrets58.jpg,Harry fighting giant snake in dark chamber of secrets
F:\DataS\data v\HP_ALL\HP2\chamberofsecrets59.jpg,Harry and Ginney looking at Pheonix bird
F:\DataS\data v\HP_ALL\HP2\chamberofsecrets60.jpg,Castle view from chamber on moonlit night
F:\DataS\data v\HP_ALL\HP2\chamberofsecrets61.jpg,Harry and Professor Dumbledore talking while dumbeldore's pheonix bird watch them in his office
F:\DataS\data v\HP_ALL\HP2\chamberofsecrets62.jpg,Lucius Malfoy looking scared and worried
F:\DataS\data v\HP_ALL\HP2\chamberofsecrets63.jpg,Injured and Untidy harry standing in the corridor
F:\DataS\data v\HP_ALL\HP2\chamberofsecrets64.jpg,Hogwarts students enjoying the feast in great hall
F:\DataS\data v\HP_ALL\HP2\chamberofsecrets65.jpg,Hogwarts castle glowing in night due to feast candles
F:\DataS\data v\HP_ALL\HP3\prisonerofazkaban01.jpg,Harry sleeping on his bed in his bedroom
F:\DataS\data v\HP_ALL\HP3\prisonerofazkaban02.jpg,Harry under his bedsheets in darkness
F:\DataS\data v\HP_ALL\HP3\prisonerofazkaban03.jpg,Harry and Dursley's family having dinner
F:\DataS\data v\HP_ALL\HP3\prisonerofazkaban04.jpg,Vernon Dursley trying to Pull floatng Marge Dursley on ground
F:\DataS\data v\HP_ALL\HP3\prisonerofazkaban05.jpg,Harry pulling his trunk on pivet drive road in late evening
F:\DataS\data v\HP_ALL\HP3\prisonerofazkaban06.jpg,Harry pulling his trunk on main road at night looking for means of transport
F:\DataS\data v\HP_ALL\HP3\prisonerofazkaban07.jpg,Drivere of wizards bus called knight bus and his floating head charm
F:\DataS\data v\HP_ALL\HP3\prisonerofazkaban08.jpg,Conductor of knight bus looking curious
F:\DataS\data v\HP_ALL\HP3\prisonerofazkaban09.jpg,Wizard making his tea in leaking cauldron which is wizards lounge
F:\DataS\data v\HP_ALL\HP3\prisonerofazkaban10.jpg,monster book of monsters hiding under bed
F:\DataS\data v\HP_ALL\HP3\prisonerofazkaban11.jpg,Arthur talking with Harry in leaking cauldron
F:\DataS\data v\HP_ALL\HP3\prisonerofazkaban12.jpg,Hogwarts express running through fog in mountains beside lake
F:\DataS\data v\HP_ALL\HP3\prisonerofazkaban13.jpg,Ron trying to look out of fogged hogwarts express window
F:\DataS\data v\HP_ALL\HP3\prisonerofazkaban14.jpg,Professor lupin using patronous spell that’s glowing his wand
F:\DataS\data v\HP_ALL\HP3\prisonerofazkaban15.jpg,Harry looking out of window in stormy night
F:\DataS\data v\HP_ALL\HP3\prisonerofazkaban16.jpg,Hogwarts castle view in stormy night under cloudy sky
F:\DataS\data v\HP_ALL\HP3\prisonerofazkaban17.jpg,Professor Dumbledore giving speech to hogwarts students
F:\DataS\data v\HP_ALL\HP3\prisonerofazkaban18.jpg,Fat lady with glass painting on wall
F:\DataS\data v\HP_ALL\HP3\prisonerofazkaban19.jpg,Ghost like demontors gliding around hogwarts castle in stormy night
F:\DataS\data v\HP_ALL\HP3\prisonerofazkaban20.jpg,Hogwarts castle and whoomping willow tree in daylight
F:\DataS\data v\HP_ALL\HP3\prisonerofazkaban21.jpg,Professor Trelawney looking puzzled
F:\DataS\data v\HP_ALL\HP3\prisonerofazkaban22.jpg,"Harry, Ron and Hermione walking down mountains beside astronomy tower"
F:\DataS\data v\HP_ALL\HP3\prisonerofazkaban23.jpg,Hippogriff a half eagle half horse standing in clear field
F:\DataS\data v\HP_ALL\HP3\prisonerofazkaban24.jpg,Harry flying on hippogriff over great lake
F:\DataS\data v\HP_ALL\HP3\prisonerofazkaban25.jpg,Scary pale looking eye staring
F:\DataS\data v\HP_ALL\HP3\prisonerofazkaban26.jpg,red medicinal flower covered in dnow
F:\DataS\data v\HP_ALL\HP3\prisonerofazkaban27.jpg,Harry and his friends standing in classroom
F:\DataS\data v\HP_ALL\HP3\prisonerofazkaban28.jpg,Big bridge connecting hogwarts and mountains
F:\DataS\data v\HP_ALL\HP3\prisonerofazkaban29.jpg,Harry and Professor lupin talking on big bridge
F:\DataS\data v\HP_ALL\HP3\prisonerofazkaban30.jpg,Ghost like demontors gliding around hogwarts castle in moonlit night
F:\DataS\data v\HP_ALL\HP3\prisonerofazkaban31.jpg,Professor dumbledore and professor snape looking worried
F:\DataS\data v\HP_ALL\HP3\prisonerofazkaban32.jpg,Hogwarts castle and Whoomping willow tree in dusk and sandy weather
F:\DataS\data v\HP_ALL\HP3\prisonerofazkaban33.jpg,Harry playing quiddich sports wearing goggles in clouds
F:\DataS\data v\HP_ALL\HP3\prisonerofazkaban34.jpg,"Harry, Ron, Hermione and his quiddich team in hospital wings"
F:\DataS\data v\HP_ALL\HP3\prisonerofazkaban35.jpg,Harry looking snow out of clock tower
F:\DataS\data v\HP_ALL\HP3\prisonerofazkaban36.jpg,Ron and Hermione looking at big hut in snow covered fields
F:\DataS\data v\HP_ALL\HP3\prisonerofazkaban37.jpg,"Harry, Ron and Hermione walking in snow covered market"
F:\DataS\data v\HP_ALL\HP3\prisonerofazkaban38.jpg,"Professor Mcgonagall, Bartender lady and Cornelius Fudge minister of magic talking in Bar"
F:\DataS\data v\HP_ALL\HP3\prisonerofazkaban39.jpg,Harry and Professor lupin talking in his office
F:\DataS\data v\HP_ALL\HP3\prisonerofazkaban40.jpg,Hagrid standing in waters of great lake staring at sky
F:\DataS\data v\HP_ALL\HP3\prisonerofazkaban41.jpg,"Hagrid, Ron and Hermione talking at great lake in cloudy weather"
F:\DataS\data v\HP_ALL\HP3\prisonerofazkaban42.jpg,Professor snape pointing his glowing wand at harry in dark corridor in night
F:\DataS\data v\HP_ALL\HP3\prisonerofazkaban43.jpg,Professor snape pointing his glowing wand at harry's paper in dark corridor 
F:\DataS\data v\HP_ALL\HP3\prisonerofazkaban44.jpg,Unlit spiral staircase in daytime
F:\DataS\data v\HP_ALL\HP3\prisonerofazkaban45.jpg,"Harry, Ron and Hermione walking on big bridge"
F:\DataS\data v\HP_ALL\HP3\prisonerofazkaban46.jpg,Hermione running on mountains scared
F:\DataS\data v\HP_ALL\HP3\prisonerofazkaban47.jpg,Harry and Hermione standing looking scared on mountain
F:\DataS\data v\HP_ALL\HP3\prisonerofazkaban48.jpg,Sirius Black smiling scared on floor while pointed by wand
F:\DataS\data v\HP_ALL\HP3\prisonerofazkaban49.jpg,Professor lupin standing smirking in dark hut
F:\DataS\data v\HP_ALL\HP3\prisonerofazkaban50.jpg,Harry and Sirius talking at night while staring at castle
F:\DataS\data v\HP_ALL\HP3\prisonerofazkaban51.jpg,Harry's green eye diverted right
F:\DataS\data v\HP_ALL\HP3\prisonerofazkaban52.jpg,Werewolf creature and Big dog fighting under moonlit sky
F:\DataS\data v\HP_ALL\HP3\prisonerofazkaban53.jpg,Harry supporting  injured Ron and Hermione protecting them
F:\DataS\data v\HP_ALL\HP3\prisonerofazkaban54.jpg,Werewolf creature howling under moonlit sky
F:\DataS\data v\HP_ALL\HP3\prisonerofazkaban55.jpg,Harry pointing his glowing wand in sky to cast patronous charm to chase away ghost like dementors
F:\DataS\data v\HP_ALL\HP3\prisonerofazkaban56.jpg,Glowing Patronous Stag standing in dark forest
F:\DataS\data v\HP_ALL\HP3\prisonerofazkaban57.jpg,Harry and Sirius lying crumbled on lake shore
F:\DataS\data v\HP_ALL\HP3\prisonerofazkaban58.jpg,Harry and Hermione standing hospital wing using time turner necklace to go back in time
F:\DataS\data v\HP_ALL\HP3\prisonerofazkaban59.jpg,Harry and Ron trying to stop Hermione from beating Draco Malfoy
F:\DataS\data v\HP_ALL\HP3\prisonerofazkaban60.jpg,"Hermione watching past Harry, Ron and Hermione near Pumpkins from behind the trees"
F:\DataS\data v\HP_ALL\HP3\prisonerofazkaban61.jpg,Harry and Hermione looking scared at something in night
F:\DataS\data v\HP_ALL\HP3\prisonerofazkaban62.jpg,Harry raised his wand to conjure his stag patronous
F:\DataS\data v\HP_ALL\HP3\prisonerofazkaban63.jpg,Serius looking worriedly at harry in dark night
F:\DataS\data v\HP_ALL\HP3\prisonerofazkaban64.jpg,Hippogriff flying at moon in cloudy sky from Hogwarts castle
F:\DataS\data v\HP_ALL\HP3\prisonerofazkaban65.jpg,Harry zooming and flying around in sky
F:\DataS\data v\HP_ALL\HP4\gobletoffire01.jpg,Solo house in big dark field field under dark sky
F:\DataS\data v\HP_ALL\HP4\gobletoffire02.jpg,Wormtail one of lord voldermorts slave smiling at door in dark
F:\DataS\data v\HP_ALL\HP4\gobletoffire03.jpg,Hermione's shadow on mountain at Dawn
F:\DataS\data v\HP_ALL\HP4\gobletoffire04.jpg,"Harry, Ron, Hermione, Arthur, George, Fred,Cedric walking over mountain clearing"
